Filename	Reflections	Pixel/Object Changes	Helper Functions	Program Instructions
bda2d7a6.png	The task involves identifying the order of the pixel values as you move from the outermost one-pixel-wide square shape of size n by n to the next n-1 by n-1 square and so on till you reach the central two by two square. Then shifting the color order of the pixel values by 1 to the right, while keeping the shapes same, such that the pixel value of the n by n square is now the pixel value for the n-1 by n-1 square.	The pixel values are changed to shift the order of the colors of the squares by one to the right as we move right from the outermost square to the innermost square.	get_pixel_coords can be used to get the pixel values and coordinates as we move from the outermost square to the innermost square. fill_between_coords can be used to fill the values in the squares in the shifted sequence as we move from the outermost square to the innermost square.	1. obtain the pixel values and coordinates from the sqaures in the input grid as we move right from the outmost square to the innermost one. 2. shift the sequence of the pixel values by one to the right. 3. color the squares in the shifted sequence as we move right from the outmost square to the innermost one.
bdad9b1f.png	The task involves extending the pixels that form a small part of a row and a column until they form the complete row and column. The pixel at the intersection is colored yellow.	The pixel values are added in order to extend the colored pixels to form a complete row and a column. The intersection pixel is colored yellow while the extended row and column follow the same color as the row and the column.	get_pixel_coords can be used to get the values and the position of the pixels. fill_between_coords can be used to color the extension of the row and the column based on their color.	1. obtain the pixel values. 2. extend the parts of the column and the row by adding pixels of the same color. 3. Color the intersected pixel yellow.
be94b721.png	The task involves selecting the biggest object in the input grid and giving it as an output.	The object is identified by the group of pixels of the same values in the inout grid.	get_objects can be used to get the objects in the input grid. get_pixel_coords can be used to identify the biggest object	1. obtain the objects 2. output the biggest object in the input grid as the output.
b7249182.png	The task involves extending the two colored pixels in the input grid such that they connect together after forming a tuning fork shaped object.	The pixels are extended by adding pixels of the same color to them. The tuning fork shape has a base of five pixels and a height of two pixels. 	get_pixel_coords can be used to get the pixel values and coordinates of the two pixels in the input grid. fill_between_coords can be used to generate the tuning fork shapes.	1. obtain the pixel values and coordinates. 2. extend the pixel so as to connect them to each other. 3. connect the two extended lines using the tuning fork shape in the end.
ba26e723.png	The task involves inserting magenta columns after every two columns starting with the first column.	The column is created by changing the yellow pixels to magenta without changing the black pixels. The columns are modified in the pattern of first column, fourth column, seventh column and so on, until the entire input grid is covered.	get_objects can be used to get the coordinates for the sequence of columns in the input grid. fill_between_coords can be used to colore the columns in the sequence from yellow to magenta.	1. obtain the coordinates of the columns forming a sequence of one, four, seven and so on. 2. color the yellow pixels into magenta.
b782dc8a.png	The task involves a maze like structure in the input grid formed using gray color. The starting pixel is colored with the adjacent black pixels colored with another color. It involves coloring the black pixels in the same alternating color pattern until the black path reaches an end and cannot go further.	The pixels are added in an alternating pattern and only the black continuously connected pixels are colored in this pattern until the end is reached and no further black pixel is present. The other black pixels that are not connected to the black pixels containing the starting poit remain unchanged.	get_pixel_coords can be used to get the mae structure to identify the continuous path made by black pixels. fill_value can be used to color those black pixels in an alternating pattern based on the colors of the starting pixels.	1. obtain the maze structure to identify the continuous paths formed using black pixels. 2. obtain the pixel colors of the starting pixel and its adjacent pixels. 3. color the path by continuing the alternating pattern until an end is reached.
b1948b0a.png	The task involves changing the values of magenta tiles into pink without changing any other pixels.	The magenta pixels are converted to red pixels while the orange pixels remain the same.	get_pixel_coords can be used to get the pixel values of the magenta pixels. fill_value can be used to change the color of the magenta pixels into red pixels.	1. obtain the magenta pixels 2. color them red
b230c067.png	The task involves identifying the three gray objects and coloring the two identical ones blue and the different one red	The objects are defined by the gray shapes in the input grid. The two shapes that are identical are colored blue and the different one is colored red.	get_objects can be used to get the gray shapes in the input grid. It can also be used to check if the corresponding positions of the pixels combine to form identical shapes. fill_object can be used to color the object blue or red.	1. obtain the gray objects. 2. identify which two of them are identical. 3. color the identical objects blue and the different one red.
b2862040.png	The task involves identifying the blue objects that form a closed loop and coloring them gray while keeping the rest of the pixels in the input grid unchanged.	The objects are defined by the blue shapes in the input grid. The shapes that form a closed figure similar to 'O' or '0' or '9' are colored gray.	get_objects can be used to get all the blue objects and also which of the objects form a closed loop by looking at the pixel coordinates. fill_object can be used to color the selected object gray.	1. obtain the blue objects. 2. identify the shapes with a closed loop in them. 3. color the identified shapes gray.
b94a9452.png	The task involves swapping the two different colors of the pixels of the object with each other.	The object is a square that is formed with pixels of two different colors. The pixel values are swapped with each other. The output is just the square having the swapped colors.	get_objects can be used to get the squares and the pixel values in the object. fill_value can be used to swap the pixel values for each pixel in the object from the original color to the other color in the object. crop_grid can be used to keep the output as the square and removing the black pixels.	1. obtain the square object. 2. identify the two pixel values that form the object. 3. swap the pixel values 4. crop the output grid to just have the square with the swapped colors.